title,salary,company,posted,district,job_description,career level,company website,qualification,job type,years of experience
management,salary,DBS Bank Ltd,2022-12-02,Kwun Tong,"Business Function

Group Technology and Operations (T&O) enables and empowers the bank with an efficient, nimble and resilient infrastructure through a strategic focus on productivity, quality & control, technology, people capability and innovation. In Group T&O, we manage the majority of the Bank's operational processes and inspire to delight our business partners through our multiple banking delivery channels.
Principal Responsibilities
MIS
To assist the team head to formulate strategies and plans in align with bank’s objectives and leading the team to achieve team’s business goals and targets
To formulate and produce the timely, accurate and quality MIS reports and share analytical insights to facilitate decision making
To develop the effective and efficiency way to compile the MIS data for MIS data maintenance
To automate and streamline reporting journey
Ops Data Insights & Trackers
To develop and maintain dashboards, key indicators for leadership team to track key metrics
To analyze historical trends, prepare forecast data to archive Demand Management, digital content enrichment opportunities
To analyze the operation efficiency from operation data to optimize operation procedures Make use of operation data to optimize operation process, enhance customer journey and reduce Employee Pain Points
To liaise with stakeholders to facilitate the data requirement and logistics
To streamline execution of the end-to-end data management process to improve the productivity and efficiency
To conduct periodical review and health check to ensure accurate data are generated for study and analysis
To draw insight from data / dashboards to identify opportunities & recommendation to users in call diversion and digital adoption
Requirements
Degree holder in Information System, Statistics, Management Science, Mathematics, or related disciplines
4-7 years relevant experience in banking or financial industry, preferably in Big Data or Business Analyst
Consumer banking operations, customer centre or wealth management operations experience is preferred
Process transformation experience is preferred
Good analytical and problem-solving skills
Good knowledge in Big Data including Data Lake architecture, Python, SQL and dashboard tools like Qlik, Tableau, Power BI, etc.
Be data sensitive with sound presentation skills
Detail-oriented and able to work independently
Initiative and a good team-player
Good interpersonal and communication skills
Proficient knowledge in business intelligence / data visualization tools
Independent and with can do attitude
Ability to work under tight deadline and handle multiple projects
Excellent command of written and spoken English and Chinese
Apply Now
We offer a competitive salary and benefits package and the professional advantages of a dynamic environment that supports your development and recognises your achievements.
We regret only shortlisted candidates will be notified.",Middle,http://www.dbs.com.hk,Degree,Full Time,10
data analyst,salary,Michael Page,2022-12-02,district,"International renowned firm
SQL, Python, Power BI, D365
Data analysis & application projects
客户简介
Our client is a large scale international-renowned firm. To cope with the growing importance of data and digital transformation, they are currently hiring a Customer Data Analyst to oversee end to end data cycle while driving digital transformation within the corporate. The candidate not only can directly present insight to the Senior Manager but also exposure to a full spectrum of Microsoft products (PowerBI, MS SQL Server, D365).
工作内容
- Liaise among internal users and vendor to ensure business requirements are well defined and properly implemented
- Support CRM implementation, ERP upgrade and B2C webpage included create scope, scheduling, resource control and migration plan.
- Optimize the data flow from System to Dashboard reporting and data cleansing.
- Formulate test plans and lead user to perform UAT testing
- Negotiate and manage with different level internal stakeholders
- Perform As-is analysis and to-be process for the customer purchase workflow process
- Streamline the workflow of business process and implement the change among organization
- Responsible for change management in ERP and develop use case.
- Develop KPI for measuring customer purchase performance as well as manage and submit global KPI dashboard.
- Report Generation using Excel, VBA, Marco, SQL by weekly/monthly/quarterly/annually
- Improve campaign effectiveness and provide data driven recommendations on optimize customer journey, improve targeting and customer engagement.
理想的求职者
Bachelor in Business Administration, Information Management or related disciplines
5+ years experience in Customer Data Analysis/ Business Analytics
Hands on with SQL, Power BI
Experinece with Python is a huge plus
Experience in end to end data management from database, analysis and visualization
Solid skills in Data Analysis · Business Analysis · Business Intelligence (BI)
Skills in Change Management · Process Improvement · Project Management
Experience with CRM/ ERP implementation, Microsoft products is a plus (e.g. Microsoft Dynamics NAV · Microsoft Dynamics CRM · Microsoft Dynamics 365
Strong communication skills in Cantonese and English, able to turn data into insights and make recommendation/ storytelling to management
Independent, proactive problem-solver
福利待遇
Our client offer sustainable career path to the candidate.
To apply online please click the 'Apply' button below. For a confidential discussion about this role please contact Eliza Lai on +852 2848 4741.",Middle,http://www.michaelpage.com.hk,Degree,"Full Time, Permanent",5
it,salary,Talent Axis Management Consulting Group Limited,2022-12-02,district,"Our client, a well-established Bank in Hong Kong, is looking for a high-calibre candidate to join their Group:
Responsibilities:
Maintain all the Bank’s policies and procedures regarding to information and Cybersecurity.
Maintain and follow the regulatory requirements on security such as HKMA Cybersecurity Fortification Initiatives (CFI) requirements so as to widen the security protection perspectives of the Bank.
Lead and perform vulnerability assessment to the Bank’s IT system.
Lead and perform system and network configuration hardening reviews to ensure the system and network security of the Bank.
Study, evaluate and implement the Information or Cybersecurity solutions for Cybersecurity protection perspectives, and provide technical & administrative support to related systems.
Requirements:
Degree holder in Computer Science or Engineering or related disciplines
CISA / CISM / CISSP or equivalent is preferred
Minimum 5 years of relevant working experience in IT Security, Information Security or IT Audit.
Solid experience in Information / Cybersecurity controls and reviews to ensure the adequate controls and the adherence to Security Policies and Standards of the Bank.
Solid experience and understanding of regulatory requirements such as HKMA SPM, Cybersecurity Fortification Initiatives (CFI), SFC, PCI-DSS and etc.
Experiences and understandings in Cyber Security principles, Information security risk managements & controls.
Familiar with the security practices on patch management, key / certificate management, privileged account management, vulnerability scanning, software / application whitelisting, APT protection, system hardening.
Knowledge on security features of firewall, router, switch, IPS/IDS, APT, VPN, Database, Windows / Linux / AIX platforms.
Interested candidates please forward your resume (in MS Word format) together with current and expected salary details by clicking the Apply Now button.",Middle,http://www.talent-axis.com,Degree,Full Time,5
it,"HK$70,000 - HK$90,000 /month",Pinpoint Asia Limited,2022-12-02,Tai Po,"Our client, a leading financial institution, is looking for a PowerBI Reporting and Dashboard Lead, specifically for their CyberSecurity analysis. The selected candidate will be leading the development of the dashboarding and reporting from the ground. Perm position and opportunity to learn CyberSecurity.
Responsibilities:
Lead the business intelligence reporting and dashboard greenfield development, particularly for CyberSecurity purposes. It would be part of the automation projects for CyberSecurity.
Lead the design, build and deploy BI solutions (e.g. PowerBI, Tableau)
Migrate all business intelligence reports to source data from centralized data analytics platforms and demise excel and/or silo data sources for reporting.
Evangelize the use of data-informed decision-making through the firm and create data-driven standards for leveraging analytics to offer both internal and external actionable insights.
Promote re-use and cross-business function awareness of analytics best practices, challenges, etc.
Requirements:
At least 6 years of development experience in Business Intelligent systems.
Excellent analytical capability to identify patterns in data and a keen sense of pattern detection and anomaly detection.
Development experience with BI solutions such as Power BI, Tableau, etc
Hands-on experience with modern enterprise data architecture and business intelligence tools.
Understanding CyberSecurity technical knowledge would be a great plus.
Financial experience is highly preferred. 
Excellent language abilities in English.
Strong business acumen in working with all levels of business users and stakeholders.
Bachelor's degree in Technology or MIS-related from a reputed University.
If this outstanding opportunity sounds like your next career move, please send your resume in Word format to Danny Kwan at resume(at)pinpointasia(dot)com and put PowerBI Reporting Lead (Cybersecurity Analytics) - Lead Financial Institution in the subject header.
Data provided is for recruitment purposes only.",Senior,http://www.pinpointasia.com,Degree,"Full Time, Permanent",6
data engineer,salary,PERSOLKELLY Hong Kong Limited,2022-12-02,Central and Western,"Our client, cognitive solutions and cloud platform company headquartered in New York with operations in over 175 countries and has played a pivotal role in Hong Kong’s development and transformation. They are currently looking for a Data Engineer to participate their team.

Responsibilities
Data engineer development work including understanding data models and preparing ETL specification
ETL flow design, development, testing, implementation and support
Source, cleanse and consolidate data from different systems & reports
Write SQL, PL/SQL, Python to run queries and support data analysis work Job requirements
Work on the end-to-end flow of a broad range of analytics use cases to deliver real business value
Perform programming for enhancement involving complex logic
Work in Agile Scrum Development Team 
Requirements
Professional data analyst/data engineer who had over five years of IT and working in insurance/finance/fin-tech/banking companies.         
More than 4 - 5years of Banking or Insurance experience, and have exposure to Financial Services industry                               
Highly skilled in SQL, Data migration, and Data Analysis.
Proficiency in Oracle DB and PL/SQL
Solid experience with ETL tool especially in informatica data quality (IDQ)
Solid experience in data transformation with large data volume
Knowledge of Stored Procedure is preferred
Knowledge in Tableau will be an advantage
Dedicated to identifying business needs and delivering solutions to customer problems
Proven ability to establish and maintain excellent communication and relationships with clients
To apply for this position, please send your full resume to Contract_hk @persolkelly.com in word format indicating the job title. If you are not contacted by our consultants within 2 weeks, please consider your application unsuccessful. All applications will be treated in strict confidence and used for recruitment purposes only in accordance with PERSOLKELLY Hong Kong Limited's Privacy Notice.",Middle,http://www.persolkelly.com.hk,Degree,Full Time,4
data engineer,salary,PERSOLKELLY Hong Kong Limited,2022-12-02,Central and Western,"Our client, cognitive solutions and cloud platform company headquartered in New York with operations in over 175 countries and has played a pivotal role in Hong Kong’s development and transformation. They are currently looking for a Cloud Data Engineer to participate their team.
Responsibilities
Design and implement data pipeline in cloud environment
Understand data schema of available data sources
Utilize technologies such as workflow engine to automate data transfer from sources to destination
Design suitable data schema for the data warehouse to enable efficient query and retrieval of data for analytic purposes
Automate & implement CI/CD delivery pipeline
Project Summary
Implement and maintain cloud-based data pipeline related projects
Automate collection and processing of data on the data pipeline
Requirements
Data processing frameworks - Spark, Hadoop
Database for big data applications - Hbase, Cassandra, Hive
Cloud based big data services - AWS Dynamo, AWS Athena, AWS Redshift, Google Big Query
At least 2 - 4 years working experience on data processing, analytical related projects
At least 4 – 5 years of Banking or Insurance experience, and have exposure to Financial Services industry
Computer science, data analytic, information engineering or related discipline.
Good command of written and spoke English and Cantonese, with strong communication skills
Candidates with more experience will be considered as Senior Engineer
To apply for this position, please send your full resume to Contract_hk @persolkelly.com in word format indicating the job title. If you are not contacted by our consultants within 2 weeks, please consider your application unsuccessful. All applications will be treated in strict confidence and used for recruitment purposes only in accordance with PERSOLKELLY Hong Kong Limited's Privacy Notice.",Middle,http://www.persolkelly.com.hk,Degree,Full Time,3
it,salary,Hong Kong Air Cargo Terminals Ltd,2022-12-02,Islands,"Duties
Perform database administration and support tasks 
Conduct database performance monitoring and tuning 
Automate routine checking and monitoring tasks and transfer operational knowledge to data centre operators 
Prepare and review change implementation rundown  
On 7X24 support roster to diagnose and resolve database problems 
Work with vendors to resolve database incidents and problems 
Qualifications
Degree or above in Computer Science, or industry related discipline 
At least 3 year(s) solid experience on database administration and support (Oracle 12c/19c RAC and Microsoft SQL Server)  
Experience with SQL, PL/SQL, database and shell script/programming 
Proficient in spoken and written English and Chinese 
Good analytical, problems solving skills and ability to work under pressure 
Self-motivated; taking ownership of projects and issues, including follow through to closure and resolution 
Candidates with less experience may be considered as IT Analyst  
Package including Chinese New Year bonus, discretionary bonus, transport subsidy, overtime allowance, annual safety bonus, quarterly special attendance bonus, employer topped-up MPF contributions, medical benefits (including family members), voluntary dental coverage (including family members), life insurance, birthday leave, extra annual leave, statutory and public holiday, marriage leave, newborn baby gift, sports centre and free shuttle bus
Interested parties please apply with full resume detailing experience, qualifications and expected salary by post, by e-mail or click ""Apply Now"". 
By post: Human Resources, 6/F, North Office Block, SuperTerminal 1, Hong Kong International Airport, HK 
Please quote the above reference in your application. To know more about our company, please visit our website https://careers.hactl.com/. 
Applicants not invited for interview within four weeks should consider their applications unsuccessful. Applicants’ personal data collected will only be used for the sole purpose of recruitment. The data of unsuccessful applicants will be destroyed within six months.",Middle,http://www.hactl.com,Degree,"Full Time, Permanent",3
data analyst,salary,ConnectedGroup Limited,2022-12-01,district,"My client is stable banking group in Asia. They are now looking for a Data Analyst for their internal audit team in Hong Kong.
Report to the team head, you will be responsible for:
Formulating audit analytics' requirements.
Obtaining data for audit purposes.
Developing audit analytics methodology.
Developing audit analytics tools or dashboards.
Supporting some projects.
Requirements:
University graduated in Finance, Business Administration, or relevant disciplines.
At least 4 years relevant experience.
Open minded and willing to take up new challenges.
Strong business sense and problem-solving skills.
Fluency in written and spoken English and Chinese (includes Putonghua).
To Apply
This is an excellent opportunity to join one of the world's leading asset managers that offer long term career growth, guidance, and development.

Interested individuals can apply now. Please send your CV in WORD format with your current and expected salary.",Middle,http://www.connectedgroup.com,Degree,"Full Time, Permanent",4
data analyst,salary,Orient Overseas Container Line Ltd (OOCL),2022-12-02,Sha Tin,"Responsibilities:
Responsible for inspecting, cleansing, data mining, transforming and modelling data with the goal of valuable insight, suggesting conclusions and supporting decision making.
Active development of identified opportunities in various business operation and process improvement.
Build analytics models, construct visualizations and use statistical tools to interpret data sets for uncovering business patterns and benefit future business processes.
Collaborating with engineers, product managers, data scientists and business user to identify opportunities for process improvements, recommend system & algorithm modifications, and corresponding user training. Assist project stakeholders to ensure IT deliverables that would satisfy business analytics requirements and would achieve anticipated business benefits.
Strong analytical skills with the ability to collect, organize, analyze, and disseminate significant amounts of information with attention to detail and accuracy and has a significant understanding of Mathematics, Economics, Shipping & Logistics, Machine Learning or Statistics fields of knowledge.
Strong communication and presentation skills to turn customer needs into business requirements and workable technology outcomes
Requirements:
Bachelor’s degree in a related field with outstanding academic results, major in Statistics, Data Science, Business Analytics, Mathematics, Operations Research, Global Supply Chain Management, Shipping & Logistics Management or related disciplines
3 - 5 years experience in data analytics, including data analysis, sourcing/modelling, ETL, and visualization / reporting would be advantage
A desire to continuously learn new techniques / technologies and bring innovative ideas into the Squad.
Numerically sensitive, creative aptitude and highly adaptable in a multicultural environment
Good analytical abilities, storytelling and time management. Capable of breaking down complex algorithm into user-friendly, logical steps for non-technical end-users
A good team player with excellent analytical, communication and presentation skills
Candidate with more experience may also consider as Senior role


Please send your application letter with detailed resume and expected salary by clicking ""Apply Now"" and quote the reference number on the subject. 
OOCL is an Equal Opportunity Employer. OOCL will retain the personal data of applicants/ unsuccessful applicants for future recruitment purpose for a period of six months. All personal data will be destroyed immediately right after the abovesaid period.",Middle,http://www.oocl.com,Degree,"Full Time, Permanent",3
data analyst,"HK$30,000 - HK$70,000 /month",Manpower Services (Hong Kong) Limited,2022-11-30,Others,"Our client is seeking an Data Analyst in their team.

Responsibilities:
Collect user requirements and provide appropriate solutions
Develop analytics reports and visualization dashboard
Develop and support analytics data model and conduct data asset management
Conduct the system implementation, configuration and deployment
Perform Unit Testing, System Integration Test, and involve in User Acceptance Test

Requirements:
University graduate in in Data Science, Data Analysis, Information Technology or related discipline
4 years or above in Data Analytics related areas
Hands-on experience in Tableau/Power BI/ Other visualization tools (Tableau is an advantage)
Experience in SAS, Python, R
Experienced in managing and developing data integration, ETL with data warehouse is preferred
Experience in IBM DataStage, DB2, Oracle, MySQL AND NoSQL DB (e.g. MongoDB, HBase) is plus
Strong communication skills is a must
Able to work as a team or individually
Good writing skills (both Chinese & English)",Entry Level,http://www.manpowergroupgrc.hk,,Contract,4
data analyst,salary,TE Connectivity HK Limited,2022-11-29,district,"Job Description – Business Analyst – Demand Forecast
Position Overview:
The Business Analyst – Demand - reports into the Head of Demand Analytics and is responsible for the processing, mining and delivery of data to his/her customer community – mostly Regional Demand Analysts -through repositories, tools and services.
He/She may also partner with the DIA and TEIS Team on forecasting tools improvement projects – IBP, Machine learning and AI.
Key Qualifications, Experiences and Knowledge
       5+ years of Data Engineering experience in ETL design, development, optimization & testing using AWS tools, PL/SQL, Oracle, HANA, Redshift, Aurora etc
       3+ years of experience with AWS tools such as S3, EC2, Aurora, Redshift, RDS, Lambda Functions, ELB, VPC, Data Glue, Data Brew Auto Scaling configurations, IAM, CloudTrail, and CloudFront.
       5+ years of experience in relational and Cloud database design, optimization, and performance; preferably with AWS (S3 and Redshift), SAP HANA, BW, Oracle, and Hadoop
       Detail oriented with excellent time management and organizational skills to meet critical deadlines
       Advanced proficiency in SQL, ETL, data modelling, and working with “Big Data”.
        Experience in CRM tools, Salesforce is preferred.
       Good knowledge on any one of these data analytics tools: R, Python, Alteryx etc.
       Clear communicator who can summarize, write, speak and present confidently to a diverse audience, operating as an internal consultant and thought partner.
       Quick learner, capable of adapting to new systems and developing and continuously improving processes.
       Fluent in English",Middle,http://www.te.com,Degree,Full Time,3
database administrator,salary,AsiaPay (HK) Ltd,2022-12-01,Eastern,"Job Description
Perform database design and architecture work, perform installation, upgrade, configuration, administration, maintenance and support, for Oracle, MySQL and other databases, cater for DR site
Perform database operation including backup and restoration, troubleshooting and SQL performance tuning, monitor usage and carry out capacity planning
Perform server upgrade and migration, including migration to cloud
Perform database security set up, do vulnerability assessment and test
Create shell scripts for automation of database utility tasks, set up monitoring tools
Collaborate with application team
Prepare system and technical documentation
Provide 24 x 7 production support
Keep abreast of the latest data management trends and technologies
Job Requirement 
Degree or above in Information Technologies, Computer Science or industry related disciplines
Minimum 5 years of experience in Oracle database administration
Solid experience in large scale database design, installation, configuration, backup & recovery, analyzing performance bottleneck and carry out tuning and monitoring
Solid experience in Linux and Windows platforms
Proficient in Oracle RAC and Data Guard
Knowledge in MSSQL, MySQL is a plus
Holder of OCA/OCP certification is preferred
Good command of written and spoken English and Chinese",Middle,http://www.asiapay.com,Degree,"Full Time, Permanent",5
