title,salary,company,posted,district,job_description,career level,company website,qualification,job type,years of experience
manager,salary,Michael Page,2022-11-18,district,"Large-scale R&D group
Drive large-scale digital transformation through data
Data collaboration, acquisition, processing, management, valuation, and governance
Azure Cloud Platform data projects
Facilitate the growth of Smart City
Explore to IoT, AI & ML
Client Details
Our client is a large-scale R&D enterprise in Hong Kong.
To cope with their business growth, they are currently hiring a Data Solution manager to facilitate the strategic plan of large scale data ecosystem, define business model for data collaborations to assist industry leaders to alleviate business challenges and facilitate them to be a tech-driven business.
Description
Facilitate the enterprise data ecosystem strategic plan and its architecture design, i.e., data acquisition, processing, management, valuation, governance
Work closely with the Business Development team to help business leaders across industries (e.g. financial services, healthcare, properties) to utilize data to transform and alleviate painpoints
Oversee end-to-end projects on data collaborations on Azure Cloud platform
Research for new cases and data partner opportunities
Coordinate with internal and external stakeholders in gathering business requirements, managing project activities
Plan and generate new data collaboration project pipelines
Work closely with external vendors to drive the R&D solutions
Profile
Bachelor's degree in Business, Statistics, Computer Science, or related subject;
A minimum 8 years experience in data solutions & architecture
Experience in vendor management
Experience in Big Data Governance, Data Management and Data Analytics
Strong analytical mindset with solid problem-solving skills, and ability to analyze complex situations, identify core issues, investigate, evaluate, and reach appropriate conclusions/solutions
Hands-on experience with cloud computing technologies in Azure is preferred
Concept with IoT, AI/ML, API, Customer Analytics is a plus
Experience in identifying and resolving problems; preparing and completing action plans
Strong communication skills in Chinese and English
Job Offer
Our client provides attractive compensation and a sustainable career path.
To apply online please click the 'Apply' button below. For a confidential discussion about this role please contact Julee Thapaon +852 2848 4746.",Senior,http://www.michaelpage.com.hk,Degree,"Full Time, Permanent",6
data analyst,salary,Lenovo PCCW Solutions,2022-11-17,district,"We are looking for a qualified and innovative Senior Business Analyst to increase the efficiency of our corporate and sales operations, build processes that meet our business needs, and ensure all business functions are aligned with our strategic goals.    The ideal candidate has a well-developed passion for following new trends in digital and technology and a passion for developing ideas/ formulating recommendations either on the general direction of the market or individual sectors (e.g. Banking, Retail, Telecommunications, etc.).
The Job
Formulate and monitor the achievement of corporate KPIs. She/he will formulate sales & operational KPIs (e.g. lead-to-sale%, average conversion rate, retention and churn rate, etc.), and will periodically generate analytics to monitor the corporate’s performance.
Promote efficiency by designing and implementing operational processes. The Senior Business Analyst will design new corporate processes (e.g. processes related to approval & management of high-risk contracts, client management, onboarding, etc.), implement them and assess compliance by using corporate systems (e.g. Salesforce).
Define and allocate sales bonuses and incentives. The successful candidate will calculate and allocate sales bonuses based on the achievements of KPIs and compliance with internal processes and procedures.
Analyse and maintain sales and operational data. She/he will generate reports and draw insights based on the raw data collected. In doing so, she/he will be using data visualization/business intelligence software (e.g. Power BI).
Provide sales system support. She/he will provide CRM system support (e.g. Salesforce) to the sales team and other primary users.
The selected candidate may also be required to perform routine administrative tasks.
Requirements
A university degree in Business or Computer Science, with 1-2 years of experience in business or sales operations/process design and management/strategic planning. Fresh graduates and candidates with less experience will also be considered for the position of Business Analyst.
Very good command of both spoken and written English is essential.
Excellent MS Excel skills are of the essence. Knowledge of VBA is not essential but would be advantageous.
Good MS PowerPoint and written/oral presentation skills in English.
Familiarity with interactive data visualization / business intelligence software (e.g. Power BI, Tableu, Qlik View, etc.) will constitute a definitive advantage.
Familiarity with basic concepts of budgeting and financial reporting is required.
Knowledge of CRM software, such as Salesforce, would be advantageous.",Entry Level,http://www.pccwsolutions.com,Degree,"Full Time, Permanent",2
data processing executive,salary,Medialink Entertainment Limited,2022-11-15,Yau Tsim Mong,"Job Responsibilities:
Translate information from contracts and orders document into company standard format;
Perform data migration activities including data cleansing, data mapping and validation and verification;
Maintain contract data format, definitions and mapping to the ERP system;
Work with IT teams for ERP project implementation;
Co-ordinate with external parties and different business teams for system preparation and operation tasks;
Perform other ad-hoc tasks/ projects as required
 Job Requirement:
Degree holder preferred from Business Analysis, Information Technology, Computer Science, or related disciplines.;
Preferred 3 years working experience in data entry and order processing. Fresh graduates are welcome to apply;
Flexible thinker, able to work proactively and independently;
Strong analytical skills with the ability to collect, organize, analyze significant amounts of information with attention to details and accuracy;
Knowledge in content distribution and licensing industry would definitely be an advantage;
Good command of written and spoken of English and Chinese is required;
Proficient in Excel, Power BI and ERP system is preferred;
Candidate with more experience will be considered as a Senior Executive position;
Immediate available is highly preferred
We offer 5-day work week, medical scheme, discretionary bonus and good career prospect to the right candidate. Interested parties, please send full resume with present & expected salaries and date availability to HR & Admin Department by Apply Now .",Middle,http://www.medialink.com.hk,Non-Degree Tertiary,"Full Time, Permanent",2
data analyst,salary,Swing Consulting Limited,2022-11-15,district,"Responsibility:
Responsible for data extraction / loading / transformation, data cleansing, report / dashboard development, ad-hoc analysis, and database management
Maintain and continually enhance routines in production ranging from daily/weekly/monthly data transformation or reporting, with a clear emphasis on the need to have fully automated routines when applicable
Assist in the development of simple/ EUC tools to support business functions
Assist in communicating results of analysis or dashboard to other team via reports/presentations/user training and assist management in tracking progress of the Data Analytics Cloud Platform project.
Qualification / Requirement:
Degree holder would be preferred in relevant field (Information management, Computer Science, Business Intelligence, Statistics, Data Science, Actuarial science, etc.)
No specific professional experience required (i.e., graduate friendly) however a professional data-related experience in an insurance, healthcare, bank, tech, or consulting company is welcomed.
Experience in marketing analytics field is also a plus.
Proficient on Excel and good command of remaining MS office suite (PowerPoint, etc.)
Coding knowledge or experience of the following is desirable: 
Database Management (preferably SQL Server)
Data Engineering Skills (at least basic SQL)
Dashboard Design / Business Intelligence (preferably Power BI)
Familiarity with the following is appreciated:
Project management tools / Agile Scrum
DevOps / Git coding practices
Azure / Cloud architecture
  Business fluency in English
Please send your full resume with MS Word format to us by email or fax: 3426 2763, or you may click the Apply Now button below. 
For other vacancies, please visit our website www.swing-hk.com
Join us on facebook – www.facebook.com/swinghk
All information provided will be treated in strict confidence and used for recruitment purposes only. ",Entry Level,http://www.swing-hk.com,Non-Degree Tertiary,Full Time,1
manager,salary,Hong Kong Aircraft Engineering Co Ltd,2022-11-16,Islands,"Are you interested in building and maintaining state-of-the-art data platforms? Would you like to take part in the journey on data analytics in the exciting aircraft maintenance industry?
Develop your career by applying to the HAECO Group today!
HAECO leads in a broad range of aviation products and services that enable our customers to build and operate their aircraft, engines and components safely and efficiently and, in doing so, we seek to deliver sustainable value to all our stakeholders.
The Data Governance Manager is responsible for establishing, monitoring, driving data governance framework, and data definition alignments. He/She will be working closely with all HAECO business units and collaboratively with Group Digital and Group IT to build a high quality HAECO Enterprise Data Platform compliant with data protection regulations.
What You’ll Do: 
Define data strategy and data protection process to ensure HAECO and third-party data including personal data are protected by clear governance metrics
Design and establish HAECO group data governance & management policy, guidelines, and controls to ensure the HAECO Enterprise Data Platform data are well operated
Identify critical data elements in HAECO group to ensure all important data are formally listed in HAECO Enterprise Data Platform data dictionary
Identify emerging technology solutions to ensure data management efficiency, data protection, data capability, are continuously improved while cost being contained 
Perform privacy impact assessment to ensure HAECO stay compliant with relevant regulations including Hong Kong's PDPO, European's GDPR and China's Personal Information Protection Law (PIPL)
Collaborate with business units, IT and Data & Analytics team to ensure data governance and data privacy guidelines being followed
What You Need: 
1. Functional and other Relevant Experience
Over 8 years of working experience in Data Governance from recognized establishments in aviation industry or other MNC
Solid experience in establishing and monitoring of data governance framework
Advanced knowledge of data privacy, confidentiality and data protection from process and risk perspective
Practical experience in dealing with business and technology issues related to enterprise data assets
Proven analytical skills to visualize opportunity and issues from data is highly preferred
Working experience in Microsoft Azure data analytics solutions is an advantage
With working experience in aviation industry is an advantage
2. Qualifications and other Relevant Knowledge
Bachelor’s degree holder in Computer Science, Information Systems, Software Engineering, Law, or related disciplines
Understand industry leading data protection management practices
With knowledge of data protection regulations, including Hong Kong's PDPO, European's GDPR and China's Personal Information Protection Law (PIPL)
Fluent in English, Mandarin is an advantage
Candidates with less experience can be considered as Data Governance Analyst

Build your career with us to deliver sustainable value to the community and our stakeholders.

How to Apply:
Please send your resume with expected salary, quoting the employer's reference no., to: Human Resources Department - Talent & Partnership Team, Hong Kong Aircraft Engineering Company Limited, 80 South Perimeter Road, Hong Kong International Airport, Lantau, Hong Kong OR submit your application via https://careers.haeco.com/hkg/job-openings/
Candidates not contacted 4-6 weeks after submission of applications and/or interviews may consider their application unsuccessful.
All information provided by candidates will be treated in strict confidence and will be used for employment purpose only.",Middle,http://www.haeco.com,Degree,"Full Time, Permanent",8
data analyst,salary,Manpower Services (Hong Kong) Limited,2022-11-15,Sourthern,"Responsibilities
Extract data from the systems, perform data analysis to support and develop business development and draw insights for product improvement
Prepare reports with analysis and recommendations to maintain the management process
Improve the team’s performance by conducting market analysis, segmentation and monitoring
Work closely with the local teams to handle various digital projects
Requirements
Degree holder in Business Analytics, Data Analytics, Data Science or other related disciplines
Minimum 3 years of relevant working experiences, preferably in insurance industry
Familiar in using MS Office, Excel VBA and SAS
Good command in both written and spoken English and Chinese",Senior,http://www.manpowergroupgrc.hk,Degree,Permanent,3
data analyst,salary,China Life Insurance (Overseas) Company Limited,2022-11-11,Kowloon City,"Responsibilities 
Collaborate with related parties: both users and IT team 
Analyze business cases and collect user requirements 
Propose whole solution, including data source, data logic, data flow, and functional specifications •
Coordinate to solve users’ daily problems 
Monitor the progress of data oriented projects

Requirements
Bachelor degree in Computer Science, Computer Engineering, Information Systems, Mathematics, Statistics or related discipline
Minimum 5 years' experience in Business Analyst or data development 
Familiar with data tools SQL, Python, one or more BI tools, database 
Familiar with data product and data development lifecycle 
Solid experience in finance or insurance service industry is preferable 
Knowledge in data management is an advantage 
Positive working attitude 
Good at communication and documentation
Good command of both written and spoken English and Chinese (including Mandarin)",Middle,http://www.chinalife.com.hk,Degree,"Full Time, Permanent",5
data analyst,salary,Hongkong Land Group Limited,2022-11-10,Central and Western,"Responsibilities:
The Data Analyst will work with the BU to understand the business priorities, design the data driven solution, and manage a team to develop the solution and business process to deliver measurable business outcomes
Understand business priorities and requirements and identify opportunities where analytics can create business value
Translate business needs into tangible analytics requirements and design the potential end-to-end solutions
Serve as the bridge between business users and data scientists / engineers to experiment, develop, test and implement successful data driven solutions
Manage the end-to-end solution delivery and the key stakeholders involved
Ensure data / model driven experiments are designed, conducted, and analyzed effectively to get insights and recommendations
Support the execution of experiment from both business and statistical requirements
Be the ambassador for enterprise-wide adoption of data and analytics capabilities
What you’ll need to succeed:
Strong marketing background and business acumen
Strong statistical knowledge and analytical skills are required; knowledge in data pipelines & architecture, data analytics is a plus
Experience in leading development projects in data analytics driven applications for business users is strongly preferred, especially in marketing and customer experiences
Understanding of SDLC and MLOps methodologies is a plus
Ability to navigate in a complex environment and achieve outcome
Passion to help business with a ‘can-do’ attitude
Excellent Communications skills in English; Chinese literacy is preferred
What you need to do now:
If you're interested in this role, click 'Apply Now'. Salary and benefits will be commensurate with qualifications and experience. For more information about Hongkong Land, please visit our website: http://www.hkland.com/
Information collected is for this recruitment and selection only. Applicants not hearing from us within four weeks from the date of advertisement may consider their applications unsuccessful. All documents and personal data of unsuccessful applicants will be destroyed once the post is filled.",Entry Level,http://www.hkland.com,Non-Degree Tertiary,"Full Time, Permanent",3
data scientist,salary,A.S. Watson Retail (HK) Limited,2022-11-10,Sha Tin," Come and join a Winning Team
 We are Awesome !
 Why Should You Join Us?
 At ASW, we believe in our people, in teamwork and the importance of your personal growth. If you are looking for the opportunity to join our award-winning international family with 16,300+ stores across 28 markets in Asia and Europe, the ASW family welcomes you…  #BePartofMORE
 You can enjoy :   
Convenient office location, less than 5 min. walk from MTR
Free round-trip lunchtime shuttle bus services to Shatin
Comprehensive Medical and Life insurance coverage, including your spouse and children
Well-equipped Gym inside our office building
Onsite Clinic and Lactation Room
Role Purpose:
We are looking for a (Senior) Data Scientist to discover valuable insights from vast amount of data that help us make smarter decisions and deliver better products and services to our customers. The primary focus of the role is to design and develop data solutions and answer business questions through applying machine learning techniques, performing statistical analysis and building high quality predictive systems integrated in our solutions.
A typical day in this Role: 
Solving complex business problems by designing and implementing algorithms and models.
Measuring and optimizing the performance of algorithms and models.
Enhancing data collection procedures to include information that is relevant to building advanced analytics.
Working closely with project managers and commercial users to understand business requirements and translating them into technical requirements.
Bringing in best practices in advanced data analytics, predictive modeling and other development processes.
Assisting in promoting data culture and practices in the organization.
 This job is a good fit for You if:  
You are a PROBLEM SOLVER.  You make decisions based on evidence-based opinions. 
You are a DETAILER.  You deliberate fully before making decisions and will need to see all the facts before reaching a conclusion. You follow up rigorously. 
You are an EXPERT.  You have in-depth knowledge of a key area and seek possible solutions through study and research. 
Success will depend on:  
Degree in Statistics, Mathematics, Computer Science, Machine Learning or related field.
Familiar with various data manipulation, machine learning & statistical techniques.
Proficient in SQL, Python and R.
Self-motivated, adaptable in a fast-paced environment and with a strong sense of ownership.
Able to initiate and drive projects to completion with minimal guidance.
Able to communicate the results of analyses in a clear and effective manner.
With a good understanding of software engineering best practices.
Please click the below video to know more about our Big Data Team:
A Day in the life of Big Data Team


What is holding you back?
 Don’t miss out on this great chance to shape Your life!
  Apply now! 
Interested parties, please send your resume with current and expected salary package to our Company’s email.  

We are an equal opportunity employer and welcome applications from all qualified candidates. The information provided will be treated in strict confidence and be used only for consideration of your application for relevant/ similar posts within the A.S. Watson Group. ",Entry Level,https://www.aswatsoncareers.com/,Degree,"Full Time, Permanent",2
manager,salary,FWD Life Insurance Company (Bermuda) Limited,2022-11-10,Wan Chai,"Established in Asia in 2013 with a trailblazer mentality, FWD is the primary insurance business of investment group, Pacific Century Group (PCG), with minority shareholders Swiss Re Group, GIC Ventures, RRJ Capital and Hopu Investments.
FWD spans 10 markets in Asia including Hong Kong SAR & Macau SAR, Thailand, Indonesia, the Philippines, Singapore, Vietnam, Japan, Malaysia and Cambodia. In Hong Kong, FWD offers life and medical insurance, general insurance, employee benefits, and financial planning. We focus on creating fresh customer experiences and making the insurance journey simpler, faster and smoother, with innovative propositions and easy-to-understand products, supported by digital technology. Through this customer-led approach, FWD aims to be a leading pan-Asian insurer by changing the way people feel about insurance.
If you are looking for a company where can fuel your inspiration and cultivate your expertise, join us on our exciting journey.
The Job
Deliver data analytics solutions to enhance customer experience, marketing engagement, revenue generation, process optimization and achieve business objectives with insights gained from analyzing company data. Support FWD customer engagement strategy (sales & services) by leveraging data, developing predictive models, and implementing customer engagement campaign as well as promoting data-driven culture across the organization.
Responsible for delivering data analysis, generating customer insights, and identifying business opportunities to support customer growth and business development
Support the end-to-end customer campaigns execution and call list generation by gathering business requirements, providing the campaign sizing, lead generation, A/B test, and performance tracking.
Identify valuable data sources (i.e.: campaign data, digital data, etc.) and collaborate with IT team and data engineers to automate collection processes
Design, develop and automate the process and tools in support of the performance monitoring and MIS reporting that are aligned with various business KPIs
Identify and recommend business opportunities by collecting and organizing customer data from a variety of CRM digital touchpoints
Leverage predictive modeling to increase and optimize customer experiences, revenue generation, ad targeting and other business challenges
Support cloud migration project, from SAS-based reporting process to Python
Occasionally support ad-hoc reporting and perform routine data checks
The Person
University graduate in Computer Science, Information Systems, Statistics, Data Science, or a related field, advanced degree is preferred
At least 5 – 8 years of experience in customer analytics and campaign management, preferably within the financial services industry
Proficiency in programming languages, SAS is highly preferred
Be passionate about data, with a proven ability to drive business results with their data-based insights
Strong business problem-solving and root cause analysis skills
Sound communication skills to work with business partners of different levels and backgrounds. Able to articulate ideas verbally and in written forms
Knowledge in machine learning and data science techniques to solve complex problems
Knowledge in Azure Cloud platform and ML pipeline development would be an asset
Able to work independently, pro-active, team player, creative and detail-oriented
We offer 5-day work, 20-22 days annual leaves, excellent learning & development opportunities and an attractive package to the right candidate.
Information collected will be treated in strict confidence and used solely for recruitment purpose. The company will retain all applications no longer than 24 months of which will be destroyed thereafter. When there are vacancies in any of our subsidiaries, holding companies, associated or affiliated companies of, or companies controlled by, or under common control with the Company during that period, we may transfer your application to them for consideration of employment. We are an equal opportunity employer. We do not discriminate on the basis of race, sex, disability or family status in employment process.",Middle,http://www.fwd.com.hk,Degree,Full Time,5
