title,salary,company,posted,district,job_description,career level,company website,qualification,job type,years of experience
machine learning,salary,Triangle Recruitment,2022-11-28,Eastern,"Responsibilities
Develop web sites, and server program using Java to implement ML solutions
Research and Development of Machine Learning solutions
Perform data management and analytics tasks in data warehouse
Responsible for system design, development, testing, implementation, enhancement and maintenance under cloud and in-house environment
Requirements
Degree in Data Science and Analytics, Applied Data Science, Computer Science, Statistics, or equivalent
Programming knowledge in Java, Python, HTML and JavaScript
Knowledge in Spring, Hibernate, and Data Warehouse Management System will be an advantage
Knowledge in Chinese Natural Language Processing is a plus
Able to meet tight deadlines and work under pressure
Strong analytic and communication skills
If this is a role for you, please apply now by sending your resume (in MS WORD format) with your expected salary to us via our company email : info @ trianglerecruit.com or click ""APPLY NOW""

**Due to the volume of applicants, only shortlisted candidates will be contacted.**
The information provided by applicants will be used for employment related purpose only. All applications will be treated in strict confidence and used exclusively for recruitment purposes.",Middle,http://www.trianglerecruit.com,Degree,"Full Time, Permanent",3
data analyst,salary,TalentQuest HR Limited,2022-11-26,Central and Western,"Our client is a reputable supply chain firm with an expanding business presence established around the regions. Their IT department is now hiring a competent Business/Data Analyst to further support their team’s initiatives.

Responsibilities:
Work with the team to support end-to-end statistical data analysis for business needs
Closely liaise with internal and external stakeholders on analysis and propose actionable solutions
Utilize available data to generate reports, analysis and interpret into business terms via data visualisation tools
Educate business users on data visualisation
Support ad-hoc tasks and requests by the management
Requirements:
Degree holder in Computer Science, IT or equivalent is preferred
At least 4 years of working experience, with related data analysis is hugely advantageous
To be well-versed with SQL and/or Python, other MS Office applications
Exposure to BI tools, such as Power BI or Tableau
Strong analytical, presentation, communication and project management skills
Great command of both written and spoken English and Chinese",Entry Level,http://www.talentquest.com.hk/,Non-Degree Tertiary,"Full Time, Permanent",4
deep learning scientist,salary,Chow Sang Sang Holdings International Limited,2022-11-25,Sham Shui Po,"Responsibilities:
Develop and support software including AI systems, database integration, interfaces, and new functionality enhancements
Deploy AI systems to production
Working collaboratively with project manager, machine learning development team, and end-users during the phases of requirement, design and development to ensure quality of deliverables and service
Prepare technical documents and reports
Requirements:
Ph.D holder or Master’s degree in Data Science, Mathematics, Computer Science, Statistics, Physics, Engineering or relevant disciplines
Minimum 3 years of relevant working experience
Proficiency in Python and C/C++
Experience in deploying and monitoring AI/ML models with web and mobile applications
Knowledge in machine learning frameworks, such as TensorFlow, Keras or PyTorch
Experience in RDBMS (e.g. MS SQL, Oracle) and/or NoSQL DB (e.g. MongoDB) is a plus
Able to work independently coupled with strong interpersonal skills
We offer 5-day-work week with competitive remuneration pion packages to the right candidate.  Interested parties please send your CV with EXPECTED SALARY through the below application procedure.
(Personal data will be used by Chow Sang Sang (CSS) for recruitment only.  CSS may refer suitable applications to other vacancies within CSS and its associated companies.  We will retain unsuccessful applications for a maximum period of 24 months.)",Middle,http://www.chowsangsang.com,Degree,"Full Time, Permanent",3
database administrator,salary,China CITIC Bank International Limited,2022-11-25,district,"Responsibilities:
Configuring and maintaining reliable supports of Oracle/ MYSQL/ MSSQL of the large scale enterprise databases
Monitoring database to ensure minimum impacts to database performance
Maintaining the normal database operation including backup and restoration, troubleshooting and SQL performance tuning and monitoring usage etc.
Participating in technical and administration tasks of database upgrade, vulnerability checks, migration and troubleshooting etc.
Assist in SQL optimization and other database performance
Provide DBA support
Requirements:
At least 4 years’ experience as a Database Administrator, with a degree holder or above in Computer Science, Information Technology or related disciplines;
Experience with database software Oracle RAC/ MYSQL master-slave replication/ MSSQL, including analysing performance bottleneck and troubleshooting;
Proficient in database architecture design, installation, migration, and upgrade;
Knowledge of cloud-based database services will be an advantage;
Familiar with Non-SQL data stores, such as Redis will be an advantage; and
Fluent spoken and written in both English and Chinese.
For more details about career opportunities with the Bank, please visit our website http://www.cncbinternational.com/careers/en/index.jsp. Please apply with full resume stating current and expected salaries.
Personal data collected will be used for recruitment related purposes only. Applicants not invited for interview within 6 weeks may consider their applications unsuccessful. However, applicants may be considered for other suitable positions within the Group for a period of not more than 2 years. Personal data will be destroyed at any time after 3 months.
China CITIC Bank International is committed to being an equal opportunities employer and intends to provide a work environment free of unlawful discrimination or harassment. All employment decisions will be made in a non-discriminatory manner.",Middle,http://www.cncbinternational.com,Degree,"Full Time, Permanent",4
manager,salary,Quality HealthCare Medical Services Ltd,2022-11-25,Kwun Tong,"Job Responsibilities

Team lead for initiatives including business operations, business intelligence, and data visualization
Deliver analytical insights to support business development and data-driven projects through CRM, campaign management, P&L modeling, and KPI monitoring
Gather requirements and collaborate with business units for ad-hoc requests.
 Job Requirements
Degree/Higher diploma in Statistics, Computer Science, Business and/or similar disciplines
At least 3 years of solid experience in business analysis
Detail-oriented and proactive with a strong sense of responsibility and ownership
Strong analytical skills and presentation skills
Experience with business intelligence tools (e.g., Power BI, Cognos, Tableau, Qlik, etc.) or proficiency in database tools (e.g., SQL, Access, Python) is an advantage
Self-learner and passionate to develop insights from massive medical data
Good team player with excellent command of English and Chinese
We offer attractive remuneration and fringe benefits. Interested parties please send your full resume with current salary and expected salary to People Team, Quality HealthCare Medical Services Limited, 6/F, Tower 1 & 2, The Quayside, 77 Hoi Bun Road, Kwun Tong, Kowloon, Hong Kong  or by clicking ""Apply Now"".

Personal data collected will be used for recruitment purposes only. Bupa will be in touch for any opportunities that matches your profile. All personal data of unsuccessful application will be destroyed 24 months from the date of receiving the application. Full version of Data Privacy Notice available upon request.",Middle,http://www.qhms.com/,Degree,"Full Time, Permanent",3
data analyst,salary,MTR Corporation Limited,2022-11-25,Kowloon City,"Responsibilities
Understand the business needs and perform data analysis from complex datasets to interpret trends or patterns, identify opportunities and threats and provide insights leading to better business decision making
Develop dashboards and business reports to achieve efficient data analysis, as well as provide input and guidance on data visualization techniques to business users
Apply machine learning algorithms and build predictive models to identify business opportunities such as online advertising and propensity modelling
Collaborate with Data Engineer to ensure the data with good quality and governed by company standards to support analytical needs
Conduct research on state-of-the-art technologies, lead the development and deployment of new technologies for generating and analysing information
Act as data and analytics ambassador to promote data and analytics capabilities to business users, educate them in leveraging these capabilities in achieving business goals
Requirements
Degree in Mathematics / Statistics / Data Science / Data Analytics / Information System / Computer Science or a related discipline
A minimum of 5 years’ experience in data analytics, managing the data warehouse, business intelligence, and modelling development
Experience in quantitative analytics, statistical analysis, forecasting/ predictive analytics, machine learning, etc
Proficiency in programming such as SQL / Python and additional experience Azure Data Factory and Databricks is an advantage
Sound experience in data visualisation software (e.g., Power BI) with good business sense
Strong interpersonal, communication and presentation skills with good command of both spoken and written English and Chinese
Applications
You are invited to apply online via http://www.mtr.com.hk/mtr_job_en or send in your CV stating the position (with reference number) you are applying for by mail to Human Resource Management Department, MTR Corporation, G.P.O. Box 9916, Hong Kong on or before 8 December 2022.
For other job openings, please visit MTR Corporation's website for more details.
All information provided by applicants will be treated in strict confidence and used for recruitment purpose only. All personal data of unsuccessful applicants will be retained for 12 months for future recruitment purpose and will then be destroyed.
 ",Middle,http://www.mtr.com.hk/eng/career/programme.html,Degree,Full Time,5
data scientist,salary,Zurich Insurance (Hong Kong),2022-11-25,Eastern,"Job Responsibilities
Lead the development of distinctive analytical and risk insights that deliver improvements in business results and customer experience through the application of advance data science techniques to complex data sets
Drives the development of next-generation, market leading, analytic techniques to build the capabilities of the Data Science Center of Excellence for APAC
Thought leadership and hands-on delivery in predictive modelling, customer analytics, intelligent automation, machine learning, NLP, OCR and AI
Establishes, maintains, and grows strong, collaborative relationships with key internal and external partners; leverages relationships to drive ongoing improvements to the data and data architecture
Lead the implementation of data science initiatives to improve customer engagement, business processes and product enhancements
Play an active role in generating distinctive analytical and risk insights for the most complex and/or strategic business challenges and opportunities, including synthesizing insights into compelling ideas and messages
Complete an in-depth diagnostic of customer needs, issues and business drivers and recommend process and system improvement to enhance customer service
Analyze and review complex data from multiple internal and external sources to make informed, authoritative technical/ professional recommendations in order to improve business performance in the medium and longer term
Job Requirements
Bachelor degree in related fields and 5 or more years of experience in data science, in which minimum 2 years’ experience in unstructured data, including natural language processing, images, voice data, etc., preferably in insurance or financial services industry
Lead and implemented data science use cases and delivered measurable benefits
Advanced knowledge of statistical and predictive modelling techniques such as machine learning, decision tress, probability networks, clustering, neural networks
Expert user in R, Python, and data wrangling packages
Interested parties please simply click ""Apply Now"" to access our ""Global Recruitment Management System"" for submitting your application.
You are invited to visit our web site at: http://www.zurich.com.hk",Middle,http://www.zurich.com.hk,Degree,"Full Time, Permanent",5
manager,salary,Ambition,2022-11-24,district,"Job Responsibilities
This is a newly created role which you will be responsible for setting up a proper framework to integrate all the existing and new data tech stack. You will build a strong data architecture to ensure data quality, integrity and governance. Working closely with various business stakeholders including but not limited to marketing, CRM, e-commerce and customer services, you will uncover needs and pain points of business users in all data related topics and technologies, and provide recommendations accordingly. You will keep abreast of latest market trends and understand new technologies for data management and identify relevant data solutions for more efficient and impactful data uses. You will work with external vendors to evaluate, identify and implement different data tools appropriate for the business.
Key Requirement
Degree holder in Information Technology, Data Analytics, Computer Science or related discipline with at least 5 years of relevant work experience related to data consulting and product management.
Strong knowledge in latest data products, tools and application is required.
Prior experience working in any B2C businesses including retail, FMCG, e-commerce and consumer good would be a big advantage.
Knowledge in data warehousing and ETL, Python and SQL is a plus but not a must.
Strong communicator with good business acumen and stakeholders management skills.
Proficient in English and Chinese (Cantonese and Mandarin) is a must.
If this job isn't quite right for you, but you know someone who would be great at this role, why not take advantage of our referral scheme? We offer HKD1000 in Apple gift cards for every referred candidate who we place in a role. Terms & Conditions Apply. https://www.ambition.com.hk/refer-a-friend",Senior,http://www.ambition.com.hk,Degree,"Full Time, Permanent",3
it,salary,IT Consulting Solutions Limited,2022-11-24,Kowloon City,"We are seeking a resourceful, experienced Senior Data Management Cloud Architect Lead for a leading transport network corporation in Hong Kong. Candidate with less experience will be considered as Junior Data Management Cloud Engineer.

About ITCS Group
ITCS Group is a global IT Managed Services firm delivering tangible outcomes for our customers.
We are privileged to include some of the world’s largest banks, insurance firms and multinationals as our customers. We also support smaller start-ups and SME's as they aspire to conquer their markets.

We are expanding on a daily basis and if you're looking for the next step in your career, want to be valued as a professional, and endeavor to exceed expectations - then we want to speak with you.

Headquartered in Singapore and strategically located in Hong Kong, Tokyo, the US, Australia, China, and India.
Requirements
University Degree or above in Engineering / Data Science / Computer Science / Information Technology or a related discipline
Certificates with specialty / associate level or above or equivalent for AWS
Professional certificate from Chartered Engineer certificate from Institution of Railway Signal Engineers / Engineering Council / Institution of Engineering and Technology / Institution of Mechanical Engineers or equivalent
Have at least 7 years’ post academic experience in leading / design / implementation / consulting for data management, cloud architecture and data analytics, aiming to ensure high level of data quality and drawing actionable insights from multiple sources of data
Experience and knowledge in leading / design / implementation / consulting the implementation of international and industrial standards in data management on AWS cloud environment (by leveraging AWS cloud computing technologies related to data management in particular S3, Data Sync, SNS, SES, SQS, Dynamo DB, Athena, Lambda, Glue)
Experience in leading / design / implementation / consulting the automatic data pipeline and data quality assurance within AWS platform
Experience in leading / design / implementation / consulting the automatic data pipeline and data quality assurance between AWS and on premises servers / other cloud platforms
Knowledge in various international and industrial standards in data management (e.g. ISO 8000 series, ISO 38505, DAMA Book)
Experience in leading / design / implementation / consulting the use of AWS cloud computing technologies related to analytics (in particular AWS Sage Maker, Kinesis, Athena, Lambda)
Experience in leading / design / implementation / consulting the use of both historical and real-time streaming data from IoT devices and other railway engineering / operations systems for analyses and data visualization, including
         • Abnormality detection
         • Trend analyses
         • Pattern identification analyses
Experience in leading / design / implementation / consulting the use of a combination of statistical modelling, predictive modelling and machine learning modelling for analyses
Have experience in all of the following sets of tools and technology:
         • Programming Language: Python, R, JavaScript, Selenium and RESTful API
         • Data Visualization Software: Tableau
Have experience in working with Agile projects
Fluent in spoken and written English, Cantonese and Mandarin 
 About the role 
Data Management and Cloud Architecture
To lead the development and design, build, test, and maintain highly scalable data management systems on Data Studio Architectural Cloud for historical and real-time streaming data from IoT devices and other railway engineering / operations systems and maintain the databases to ensure the data management process complies with international ISO standards or equivalent

To lead the development and set up and maintain automated data processes and pipelines between Data Studio Architectural Cloud and other parts of Data Studio Cloud Platform 

 Syncing up data between cloud platforms, continuous connection between cloud platforms, checking functions for data quality and availability

To lead, design, manage and housekeep document / source code version for the data management system and pipelines

Data Analytics
To lead the development and design, build, test, and maintain highly scalable data analytic systems on Data Studio Architectural Cloud for historical and real-time streaming data from IoT devices and other railway engineering / operations systems. A combination of statistical modelling, predictive modelling and machine learning modelling shall be applied to power the analytic systems, which may include but not limited to the following:

     • Abnormality detection
     • Trend analyses
     • Pattern identification analyses

To lead the development of and design and create data visualization dashboard and reports to communicate data analytics insights effectively.",Senior,http://www.itcs-group.com,Degree,"Full Time, Contract",7
data engineer,salary,Sun Hung Kai Properties,2022-11-23,Wan Chai,"Requirements
Bachelor’s degree in Computer Science, Information System, Information Management, Quantitative Analysis, Statistics, IT or related discipline
Minimum 4-6 years’ experience in data analytics and business insights of loyalty programs in fast-paced industries
Proficiency in Python, Tableau & SQL programming (e.g. MySQL, PostgreSQL and BigQuery etc)
Strong business acumen, analytical skills and numerical sense, able to work independently
Have good communication and interpersonal skills
Experience in managing complex customer data from multiple sources would be an advantage
Candidates with Interest in data engineering or database management is welcomed
Responsibilities
Organize and prepare regular business analysis reports
Assist in managing the overall data analytics framework for the loyalty program with an aim to drive sales and business profitability
Develop Business Intelligence tools / Dashboards to facilitate efficient cross-platform data analysis
Manage & design data warehouse, ETL process development & automate data process of mobile app loyalty program
Maintain data governance, data integrity and conduct periodic quality assurance tracking of the Company’s customer loyalty program’s databases
Good remuneration and attractive fringe benefits will be offered to the successful applicant. Interested parties please apply with full resume, present and expected salary, available date by clicking ""Apply Now"".
We are an equal opportunity employer and welcome applications from all qualified candidates. All personal data collected will be used for recruitment purpose only. Applicants not hearing from us within 3 months may consider their applications unsuccessful. All personal data collected will be destroyed within 24 months.",Middle,http://www.shkp.com.hk,Degree,"Full Time, Permanent",4
data analyst,salary,AIA Hong Kong and Macau,2022-11-23,Wong Tai Sin,"At AIA we’ve started an exciting movement to create a healthier, more sustainable future for everyone.
It’s about finding new ways to not only better people's lives, but to better the communities and environments we live in. Encompassing our ambition of helping a billion people live Healthier, Longer, Better Lives by 2030.
And to get there, we need ambitious people who believe in playing an important part in shaping that future. People seeking unmatched career and personal growth opportunities, who are driven to work with, and learn from some of the most inspiring and supportive leaders in the business.
Sound like you? Then read on.
WE ARE LOOKING FOR .....
Improve the operation efficiency to ensure quality reporting and provide insights to management and group office. Design, implement and evaluate advance statistical and machine learning models and approaches for application to various business problem statements relating to all Operation matters
Roles and Responsibilities:
Operation Performance and Analytics
Produce quality reports and provide business insights to management and Group Office
Identify and investigate deviations from KPI matrix and propose improvement plan to business units, IT and ensure successful execution
Design statistical and machine learning models which can benefit in identifying operation improvement areas efficiently
Propose and implement solutions to business problem statements of operations
Provide technical advice and business solutions to KPI reporting
Create data models for user self-help data extraction and data alignment to management reporting
Initiate Report Automation to minimize manual works
Review and align new Technology, Digital and Analytics initiatives to company synergy
Project Management
Continuous monitoring of projects after launch and evaluate the benefit realization achievement compared to the target and propose improvement plan to Business Units to achieve KPI
Solve application and process related problems by creating detail process and system design specifications; and works with other areas across the business units to support a total solution approach
Others
Provide support to other ad-hoc initiatives by management
Minimum Job Requirements:
University graduate in Business or IT discipline with 6 years’ experience
Concrete experience in data mining, machine learning and Business Intelligence tools
Experience in Insurance Operations, Insurance Systems, EDW Systems and SDLC cycle
Candidate with HK Insurance Intermediary Examination Paper 1,2, 3 4 and 5 or equivalent is an added advantage
Good communication and presentation skill
Language proficiency with fluency in Mandarin and /or English is an added advantage
Knowledge of project management, process improvement methodologies will be and added advantage
Attentive to details, strong numeric sense and ability to resolve problems
You are required to obtain relevant licence if your job involves in regulated activities
Welcome fresh graduates as A
Build a career with us as we help our customers and the community live Healthier, Longer, Better Lives.
You must provide all requested information, including Personal Data, to be considered for this career opportunity. Failure to provide such information may influence the processing and outcome of your application. You are responsible for ensuring that the information you submit is accurate and up-to-date.",Entry Level,http://www.aia.com.hk/,Degree,Full Time,1
